{
  "schema_version": "1.0",
  "dataset_version": "demo-2026-08-09-seed-22315",
  "generated_at": "2026-08-09T15:00:00.000Z",
  "source": "demo:legacy-csv",
  "record_count": 60,
  "checksum_sha256": "754fac9509b8adc753c1ab8d9c411ae11b53574045b96509126c347751aa3504",
  "records": [
    {
      "num_cep": "D100001",
      "nombres_completos": "PERSONA SINTETICA 001 PATRICIA QUISPE ALVAREZ",
      "consejo_regional": "CONSEJO REGIONAL II LA LIBERTAD",
      "estado_habilidad": "Inhabilitado",
      "fecha_actualizacion": "2026-07-26T12:00:00.000Z",
      "foto_url": null
    },
    {
      "num_cep": "D100002",
      "nombres_completos": "PERSONA SINTETICA 002 CARMEN VARGAS QUISPE",
      "consejo_regional": "CONSEJO REGIONAL DEMO LIMA",
      "estado_habilidad": "Habilitado",
      "fecha_actualizacion": "2026-07-26T12:00:00.000Z",
      "foto_url": "/demo/fotos/persona-sintetica-002.webp"
    },
    {
      "num_cep": "D100003",
      "nombres_completos": "PERSONA SINTETICA 003 ROSA ALVAREZ ROJAS",
      "consejo_regional": "CONSEJO REGIONAL DEMO AREQUIPA",
      "estado_habilidad": "Habilitado",
      "fecha_actualizacion": "2026-07-26T12:00:00.000Z",
      "foto_url": "/demo/fotos/persona-sintetica-003.webp"
    },
    {
      "num_cep": "D100004",
      "nombres_completos": "PERSONA SINTETICA 004 MARIA SALAZAR CASTILLO",
      "consejo_regional": "CONSEJO REGIONAL DEMO CUSCO",
      "estado_habilidad": "Habilitado",
      "fecha_actualizacion": "2026-08-03T12:00:00.000Z",
      "foto_url": "/demo/fotos/persona-sintetica-004.webp"
    },
    {
      "num_cep": "D100005",
      "nombres_completos": "PERSONA SINTETICA 005 GLORIA VARGAS TORRES",
      "consejo_regional": "CONSEJO REGIONAL DEMO PIURA",
      "estado_habilidad": "Inhabilitado",
      "fecha_actualizacion": "2026-07-28T12:00:00.000Z",
      "foto_url": "/demo/fotos/persona-sintetica-005.webp"
    },
    {
      "num_cep": "D100006",
      "nombres_completos": "PERSONA SINTETICA 006 GLORIA HUAMAN FLORES",
      "consejo_regional": "CONSEJO REGIONAL II LA LIBERTAD",
      "estado_habilidad": "Habilitado",
      "fecha_actualizacion": "2026-08-03T12:00:00.000Z",
      "foto_url": "/demo/fotos/persona-sintetica-006.webp"
    },
    {
      "num_cep": "D100007",
      "nombres_completos": "PERSONA SINTETICA 007 GLORIA ROJAS MAMANI",
      "consejo_regional": "CONSEJO REGIONAL DEMO LIMA",
      "estado_habilidad": "Habilitado",
      "fecha_actualizacion": "2026-07-29T12:00:00.000Z",
      "foto_url": "/demo/fotos/persona-sintetica-007.webp"
    },
    {
      "num_cep": "D100008",
      "nombres_completos": "PERSONA SINTETICA 008 ROSA SALAZAR ROJAS",
      "consejo_regional": "CONSEJO REGIONAL DEMO AREQUIPA",
      "estado_habilidad": "Inhabilitado",
      "fecha_actualizacion": "2026-08-07T12:00:00.000Z",
      "foto_url": null
    },
    {
      "num_cep": "D100009",
      "nombres_completos": "PERSONA SINTETICA 009 ELENA ROJAS SALAZAR",
      "consejo_regional": "CONSEJO REGIONAL DEMO CUSCO",
      "estado_habilidad": "Habilitado",
      "fecha_actualizacion": "2026-08-07T12:00:00.000Z",
      "foto_url": "/demo/fotos/persona-sintetica-009.webp"
    },
    {
      "num_cep": "D100010",
      "nombres_completos": "PERSONA SINTETICA 010 GLORIA QUISPE CHAVEZ",
      "consejo_regional": "CONSEJO REGIONAL DEMO PIURA",
      "estado_habilidad": "Habilitado",
      "fecha_actualizacion": "2026-08-04T12:00:00.000Z",
      "foto_url": "/demo/fotos/persona-sintetica-010.webp"
    },
    {
      "num_cep": "D100011",
      "nombres_completos": "PERSONA SINTETICA 011 JULIA VARGAS QUISPE",
      "consejo_regional": "CONSEJO REGIONAL II LA LIBERTAD",
      "estado_habilidad": "Habilitado",
      "fecha_actualizacion": "2026-08-01T12:00:00.000Z",
      "foto_url": "/demo/fotos/persona-sintetica-011.webp"
    },
    {
      "num_cep": "D100012",
      "nombres_completos": "PERSONA SINTETICA 012 LUCIA CHAVEZ ALVAREZ",
      "consejo_regional": "CONSEJO REGIONAL DEMO LIMA",
      "estado_habilidad": "Habilitado",
      "fecha_actualizacion": "2026-08-02T12:00:00.000Z",
      "foto_url": "/demo/fotos/persona-sintetica-012.webp"
    },
    {
      "num_cep": "D100013",
      "nombres_completos": "PERSONA SINTETICA 013 ROSA VARGAS GARCIA",
      "consejo_regional": "CONSEJO REGIONAL DEMO AREQUIPA",
      "estado_habilidad": "Habilitado",
      "fecha_actualizacion": "2026-07-24T12:00:00.000Z",
      "foto_url": "/demo/fotos/persona-sintetica-013.webp"
    },
    {
      "num_cep": "D100014",
      "nombres_completos": "PERSONA SINTETICA 014 ROSA SALAZAR SALAZAR",
      "consejo_regional": "CONSEJO REGIONAL DEMO CUSCO",
      "estado_habilidad": "Habilitado",
      "fecha_actualizacion": "2026-08-01T12:00:00.000Z",
      "foto_url": "/demo/fotos/persona-sintetica-014.webp"
    },
    {
      "num_cep": "D100015",
      "nombres_completos": "PERSONA SINTETICA 015 SOFIA SALAZAR FLORES",
      "consejo_regional": "CONSEJO REGIONAL DEMO PIURA",
      "estado_habilidad": "Habilitado",
      "fecha_actualizacion": "2026-08-06T12:00:00.000Z",
      "foto_url": null
    },
    {
      "num_cep": "D100016",
      "nombres_completos": "PERSONA SINTETICA 016 ROSA TORRES FLORES",
      "consejo_regional": "CONSEJO REGIONAL II LA LIBERTAD",
      "estado_habilidad": "Inhabilitado",
      "fecha_actualizacion": "2026-08-07T12:00:00.000Z",
      "foto_url": "/demo/fotos/persona-sintetica-016.webp"
    },
    {
      "num_cep": "D100017",
      "nombres_completos": "PERSONA SINTETICA 017 ANA SALAZAR RAMIREZ",
      "consejo_regional": "CONSEJO REGIONAL DEMO LIMA",
      "estado_habilidad": "Habilitado",
      "fecha_actualizacion": "2026-07-24T12:00:00.000Z",
      "foto_url": "/demo/fotos/persona-sintetica-017.webp"
    },
    {
      "num_cep": "D100018",
      "nombres_completos": "PERSONA SINTETICA 018 MELISSA VARGAS HUAMAN",
      "consejo_regional": "CONSEJO REGIONAL DEMO AREQUIPA",
      "estado_habilidad": "Habilitado",
      "fecha_actualizacion": "2026-08-07T12:00:00.000Z",
      "foto_url": "/demo/fotos/persona-sintetica-018.webp"
    },
    {
      "num_cep": "D100019",
      "nombres_completos": "PERSONA SINTETICA 019 MARIA RAMIREZ RAMIREZ",
      "consejo_regional": "CONSEJO REGIONAL DEMO CUSCO",
      "estado_habilidad": "Inhabilitado",
      "fecha_actualizacion": "2026-08-02T12:00:00.000Z",
      "foto_url": "/demo/fotos/persona-sintetica-019.webp"
    },
    {
      "num_cep": "D100020",
      "nombres_completos": "PERSONA SINTETICA 020 ROSA VARGAS ALVAREZ",
      "consejo_regional": "CONSEJO REGIONAL DEMO PIURA",
      "estado_habilidad": "Habilitado",
      "fecha_actualizacion": "2026-08-05T12:00:00.000Z",
      "foto_url": "/demo/fotos/persona-sintetica-020.webp"
    },
    {
      "num_cep": "D100021",
      "nombres_completos": "PERSONA SINTETICA 021 ANA ROJAS VARGAS",
      "consejo_regional": "CONSEJO REGIONAL II LA LIBERTAD",
      "estado_habilidad": "Inhabilitado",
      "fecha_actualizacion": "2026-07-29T12:00:00.000Z",
      "foto_url": "/demo/fotos/persona-sintetica-021.webp"
    },
    {
      "num_cep": "D100022",
      "nombres_completos": "PERSONA SINTETICA 022 CARMEN MENDOZA TORRES",
      "consejo_regional": "CONSEJO REGIONAL DEMO LIMA",
      "estado_habilidad": "Habilitado",
      "fecha_actualizacion": "2026-08-01T12:00:00.000Z",
      "foto_url": null
    },
    {
      "num_cep": "D100023",
      "nombres_completos": "PERSONA SINTETICA 023 ELENA CASTILLO MAMANI",
      "consejo_regional": "CONSEJO REGIONAL DEMO AREQUIPA",
      "estado_habilidad": "Habilitado",
      "fecha_actualizacion": "2026-08-03T12:00:00.000Z",
      "foto_url": "/demo/fotos/persona-sintetica-023.webp"
    },
    {
      "num_cep": "D100024",
      "nombres_completos": "PERSONA SINTETICA 024 MELISSA VARGAS ALVAREZ",
      "consejo_regional": "CONSEJO REGIONAL DEMO CUSCO",
      "estado_habilidad": "Habilitado",
      "fecha_actualizacion": "2026-07-29T12:00:00.000Z",
      "foto_url": "/demo/fotos/persona-sintetica-024.webp"
    },
    {
      "num_cep": "D100025",
      "nombres_completos": "PERSONA SINTETICA 025 VERONICA SANCHEZ TORRES",
      "consejo_regional": "CONSEJO REGIONAL DEMO PIURA",
      "estado_habilidad": "Habilitado",
      "fecha_actualizacion": "2026-07-22T12:00:00.000Z",
      "foto_url": "/demo/fotos/persona-sintetica-025.webp"
    },
    {
      "num_cep": "D100026",
      "nombres_completos": "PERSONA SINTETICA 026 PATRICIA SALAZAR GARCIA",
      "consejo_regional": "CONSEJO REGIONAL II LA LIBERTAD",
      "estado_habilidad": "Inhabilitado",
      "fecha_actualizacion": "2026-07-31T12:00:00.000Z",
      "foto_url": "/demo/fotos/persona-sintetica-026.webp"
    },
    {
      "num_cep": "D100027",
      "nombres_completos": "PERSONA SINTETICA 027 CARMEN QUISPE MENDOZA",
      "consejo_regional": "CONSEJO REGIONAL DEMO LIMA",
      "estado_habilidad": "Habilitado",
      "fecha_actualizacion": "2026-07-26T12:00:00.000Z",
      "foto_url": "/demo/fotos/persona-sintetica-027.webp"
    },
    {
      "num_cep": "D100028",
      "nombres_completos": "PERSONA SINTETICA 028 DANIELA RAMIREZ ROJAS",
      "consejo_regional": "CONSEJO REGIONAL DEMO AREQUIPA",
      "estado_habilidad": "Habilitado",
      "fecha_actualizacion": "2026-07-23T12:00:00.000Z",
      "foto_url": "/demo/fotos/persona-sintetica-028.webp"
    },
    {
      "num_cep": "D100029",
      "nombres_completos": "PERSONA SINTETICA 029 GLORIA ALVAREZ VARGAS",
      "consejo_regional": "CONSEJO REGIONAL DEMO CUSCO",
      "estado_habilidad": "Inhabilitado",
      "fecha_actualizacion": "2026-08-05T12:00:00.000Z",
      "foto_url": null
    },
    {
      "num_cep": "D100030",
      "nombres_completos": "PERSONA SINTETICA 030 MELISSA VARGAS VARGAS",
      "consejo_regional": "CONSEJO REGIONAL DEMO PIURA",
      "estado_habilidad": "Habilitado",
      "fecha_actualizacion": "2026-07-22T12:00:00.000Z",
      "foto_url": "/demo/fotos/persona-sintetica-030.webp"
    },
    {